{
  "schema": "iv.aom/management-snapshot/v1",
  "snapshot_id": "snapshot-freddie-20260903T140800Z",
  "authority": "none_projection_only",
  "generated_at": "2026-09-03T14:08:00Z",
  "stale_after": "2026-09-03T14:13:00Z",
  "source_revisions": {
    "kanban": 42,
    "worker_adapter": 19,
    "product_registry": 318
  },
  "attention_items": [
    {
      "severity": "warning",
      "title": "Synthetic example: evidence verification pending",
      "detail": "Do not accept or publish until the checkpoint matches the reviewed tree.",
      "source_ref": {"domain": "work", "id": "FREDDIE-184", "revision": 7},
      "decision_required": false
    }
  ],
  "work_summary": [
    {"status": "running", "count": 1},
    {"status": "blocked", "count": 0}
  ],
  "active_delegations": [
    {
      "task_ref": {"domain": "work", "id": "FREDDIE-184", "revision": 7},
      "run_ref": {"domain": "worker", "id": "run-FREDDIE-184-implement-1"},
      "model": "gpt-5.6-luna",
      "state": "running",
      "deep_link": "shelley://conversation/8e7c-example"
    }
  ],
  "recent_publications": [
    {"domain": "publication", "id": "product:freddie-sflld", "version": "synthetic-93"}
  ],
  "producer": {"id": "scarf-snapshot-generator", "version": "0.1.0"}
}
